ID;Name;Categories;Price;Reference;Description;Usage;Weight;Brand;Image URLs;Feature
43;KFD Premium X-Whey (WPI, WPC, WPH/Gold Mix) - 540 g;Odżywki i suplementy,Białko,Mieszanki białek;66.66;KFD X-WHEY 540;UWAGA! Smaki czekoladowe - różnica w cenie wynika z różnicy w podatku VAT produktów zawierających kakao (zwykłe smaki - 8% VAT, z kakao - aż 23%). KFD Premium X-Whey WPI, WPC & WPH to najwyższej jakości odżywka wysokobiałkowa zawierająca aż 3 frakcje białkowe. W skład kompleksu wchodzi WPI 90 (izolat białka serwatkowego), WPC 80 (koncentrat białka serwatkowego) oraz WPH (hydrolizat białka serwatkowego). Wszystkie z nich są instantyzowane, dzięki czemu doskonale się mieszają, a po przygotowaniu nie powstaje uporczywa piana. Podział procentowy frakcji: WPI 90 (izolat białka serwatkowego) - 65% WPC 80 (koncentrat białka serwatkowego) - 25% WPH (Hydrolizat białka serwatkowego) - 10% Stosunek izolatu do koncentratu i do hydrolizatu wynosi 65/25/10, dzięki czemu w efekcie otrzymujemy produkt charakteryzujący się bardzo dużą czystością. W połączeniu z właściwym treningiem i dietą białko przyczynia się do wzrostu i utrzymania masy mięśniowej, pomaga też utrzymać zdrowe kości. Naszym zdaniem, do zalet KFD Premium X-Whey należy zaliczyć: - wysoką zawartość pełnowartościowego białka - niewielką ilość tłuszczu i węglowodanów Uwagi dotyczące produktu Wartości odżywcze mogą się różnić ok. 2-7% w zależności od wersji smakowej. Archiwalne badania składu produktu: - Badania na zawartość białka i brak alergenu (27.10.2017) - Badania potwierdzające zawartosć białka na poziomie 85 % (kliknij tu) .;Jedną porcję – 30 g (około 1,5 miarki) należy wsypać do naczynia z 200-250 ml mleka lub wody i wymieszać. Spożyć bezpośrednio po przygotowaniu, w zależności od indywidulanych potrzeb, nie częściej niż dwa razy dziennie.;0.586000;KFD Nutrition;https://sklep.kfd.pl/12640-home_default/kfd-premium-x-whey-wpi-wpc-wphgold-mix-540-g.jpg,https://sklep.kfd.pl/12640-large_default/kfd-premium-x-whey-wpi-wpc-wphgold-mix-540-g.jpg;Sposób użycia:Jedną porcję – 30 g (około 1,5 miarki) należy wsypać do naczynia z 200-250 ml mleka lub wody i wymieszać. Spożyć bezpośrednio po przygotowaniu, w zależności od indywidulanych potrzeb, nie częściej niż dwa razy dziennie.:0:1
44;KFD Premium Sauce - Sriracha Mayo - 410 g (Gęsty Sos);Zdrowa Żywność,Kuchnia i dieta,Sosy i syropy;12.99;SRIRACHA;KFD Premium Sauce - Sriracha Mayo to nasza propozycja dla miłośników wytrawnych i pikantnych smaków. Gęsty, kremowy i aksamitny sos na bazie wegańskiego majonezu o obniżonej zawartości tłuszczu, dostarcza zaledwie 6 kcal w porcji (5 g). Wyjątkowy smak i pikantność nadaje mu dodatek chili i czosnku. Produkt jest wyśmienitym dodatkiem do dań na zimno jak i na gorąco. Sos Premium Sriracha Mayo : - Unikalna receptura smakowa. - Gęsta, aksamitna konsystencja. - Zaledwie 6 kcal w porcji sosu. Należy pamiętać , że sosy zero kalorii lub produkty niskokaloryczne nie są 100% zamiennikami smakowymi wersji z cukrem czy tłuszczem. To tłuszcze i cukry są nośnikami smaku. Prezentowany produkt, w przeciwieństwie do klasycznych sosów na bazie majonezu zawiera zaledwie 10 g tłuszczów w 100 g produktu. Przechowywanie: przechowywać w temperaturze 2-20 °C. Po otwarciu przechowywać w lodówce. Nie dłużej niż 10 dni. Uwaga: wysyłamy sosy z terminami przydatności do spożycia nawet od 2 do kilkunastu tygodni. Warto wziąć to uwagę planując zakupy.  Produkt należy przechowywać w lodówce, spożyć najlepiej w około 10 dni po otwarciu.;Porcję produktu (5g) stosować jako dodatek do dań. Stosować w zależności od indywidualnych potrzeb, spożyć bezpośrednio po przygotowaniu;0.500000;KFD Nutrition;https://sklep.kfd.pl/16888-large_default/kfd-premium-sauce-sriracha-mayo-410-g-gesty-sos.jpg,https://sklep.kfd.pl/16888-home_default/kfd-premium-sauce-sriracha-mayo-410-g-gesty-sos.jpg;Sposób użycia:Porcję produktu (5g) stosować jako dodatek do dań. Stosować w zależności od indywidualnych potrzeb, spożyć bezpośrednio po przygotowaniu:0:1
45;KFD Precyzyjna Waga do odważania odżywek;Akcesoria i ubrania,Akcesoria treningowe,Pozostałe akcesoria;19.99;WAGA;Kieszonkowa i precyzyjna waga , która umożliwia, między innymi, dokładne odmierzanie porcji odżywek. Duży zakres pomiaru, od 0,01 g do 200 g , sprawia, że urządzenie nadaje się praktycznie do każdego typu suplementu diety oraz do wielu artykułów spożywczych. Nie musisz korzystać z osobnego, lżejszego naczynia, możesz odważać składniki na swojego ulubionego szejka bezpośrednio do shakera. Produkt idealny dla osób, które irytuje niska dokładność miarek w produktach. KFD Waga do odważania odżywek to: - wygodne i precyzyjne urządzenie, - szeroki zakres pomiaru (od 0,01 g do 200 g), - dokładność pomiaru: 0,01 g, - różne jednostki miary w tym: g, dwt, ct, gn, - funkcja tarowania, - funkcja automatycznie wyłączająca urządzenie, - funkcja wskazująca przeładowanie wagi. W komplecie znajdują się baterie (2x AAA) oraz instrukcja obsługi w języku polskim . Wszystko gotowe do natychmiastowego używania.;;0.300000;KFD Sp. z o. o.;https://sklep.kfd.pl/14506-home_default/kfd-precyzyjna-waga-do-odwazania-odzywek.jpg,https://sklep.kfd.pl/14506-large_default/kfd-precyzyjna-waga-do-odwazania-odzywek.jpg;
46;KFD Premium PWR (Pre-Workout) - 375 g;Odżywki i suplementy,Odżywki Przedtreningowe,Przedtreningówka;59.99;KFD PRE-WORII;UWAGA - Produkt ze względu na zawartość beta-alaniny, jabłczanu cytruliny i kofeiny bezwodnej, wykazuje silne właściwości higroskopijne (jest silnie podatny na wchłanianie wilgoci). Tworzenie się tzw. zbryleń czy jednolitej (zbitej) konsystencji, nie oznacza utraty właściwości produktu. Nawet całkowicie zbrylony produkt można bez przeszkód rozdrobnić i stosować. Jeżeli te właściwości są dla Ciebie przeszkodą do stosowania, to odradzamy kupno. Datę produkcji można sprawdzić przez datę przydatności do spożycia (2 lata od daty produkcji). KFD PWR to produkt oparty o sprawdzoną recepturę zawierającą wyłącznie sprawdzone substancje bez zbędnych wypełniaczy. Jest to zaawansowany kompleks przedtreningowy o udoskonalonej formule , w skład którego wchodzą: cytrulina, AAKG (jako forma argininy), Beta Alanina, kofeina, tauryna, oraz tyrozyna, czyli substancje obecne w każdej, porządnej przedtreningówce. W nowej odsłonie produkt wzbogacono o inozytol , nazywany potocznie witaminą B8, który przyczynia się do sprawności i koncentracji umysłowej. Pre-Workout zawiera również dodatek waliny. Ponadto ograniczono do minimum ilość substancji przeciwzbrylających, nie zastosowano żadnych tanich wypełniaczy, zastosowano za to dopracowane receptury smakowe, aby klient otrzymał produkt w jak najwyższej jakości, w możliwie najniższej cenie. KFD PWR zawiera m.in.: - Beta-Alaninę , która opóźnia początek zmęczenia, zwiększa poziom karnozyny mięśniowej, pomaga wzmocnić intensywność treningu beztlenowego, pomaga poprawić wydajność ćwiczeń i zmniejszyć zmęczenie mięśni - kofeinę , która poprawia wydolność fizyczną, pomaga wydłużyć czas ćwiczeń poprzez opóźnienie zmęczenia oraz może poprawić wydajność wytrzymałościową organizmu - taurynę , która odgrywa ważną rolę w układzie odpornościowym oraz wspomaga sprawność fizyczną i umysłową w przypadkach przejściowego stresu Produkt może odnaleźć zastosowanie w sportach siłowych, sylwetkowych i siłowo-wytrzymałościowych. Źródła: https://efsa.onlinelibrary;Jedną porcję - 11 g (1 i 3/4 miarki) należy wsypać do naczynia z 150 – 200 ml wody i wymieszać. Stosować w zależności od indywidualnych potrzeb, bezpośrednio po przygotowaniu, nie częściej niż raz dziennie, np. 30 minut przed treningiem.;0.470000;KFD Nutrition;https://sklep.kfd.pl/13582-home_default/kfd-premium-pre-workout-375-g.jpg,https://sklep.kfd.pl/13582-large_default/kfd-premium-pre-workout-375-g.jpg;Sposób użycia:Jedną porcję - 11 g (1 i 3/4 miarki) należy wsypać do naczynia z 150 – 200 ml wody i wymieszać. Stosować w zależności od indywidualnych potrzeb, bezpośrednio po przygotowaniu, nie częściej niż raz dziennie, np. 30 minut przed treningiem.:0:1
47;KFD Forskolin - 90 tabl. (Forskolina);Zdrowie i kondycja,Zdrowie,Antyoksydanty;32.99;KFD FORSKOLINA;KFD Forskolin to wysoko skoncentrowany ekstrakt z pokrzywy indyjskiej (coleus forskohli) w formie tabletek. Substancja aktywna - froskolina – wg wielu badań dysponuje sporym potencjałem w zakresie wspierania poprawy składu ciała i ogólnej kondycji. Jak we wszystkich naszych produktach tego typu, preparat powstał z ekstraktu standaryzowanego, w tym wypadku na aż 10 % forskoliny. W opinii wielu badaczy forskolina może wspierać szereg procesów : - Ułatwia redukcję tkanki tłuszczowej (1) - Zwiększa wrażliwość komórek na działanie insuliny (2) - Wspomaga pracę układu odpornościowego (3) - Wspiera pracę układu krwionośnego (4) - Sprzyja regeneracji układu nerwowego (5) (1) https://www.ncbi.nlm.nih.gov/pubmed/8298800 (2) https://www.ncbi.nlm.nih.gov/pmc/articles/PMC4663611/ (3) https://www.ncbi.nlm.nih.gov/pubmed/1975571 (4) https://www.ncbi.nlm.nih.gov/pubmed/8298800 (5) https://www.ncbi.nlm.nih.gov/pubmed/21779558;Zaleca się spożywać 1 porcję (1 tabletka) dziennie. Tabletkę spożyć w całości i popić wodą.;0.100000;KFD Nutrition;https://sklep.kfd.pl/11243-home_default/kfd-forskolin-90-tabl-forskolina.jpg,https://sklep.kfd.pl/11243-large_default/kfd-forskolin-90-tabl-forskolina.jpg;Sposób użycia:Zaleca się spożywać 1 porcję (1 tabletka) dziennie. Tabletkę spożyć w całości i popić wodą.:0:1
48;KFD Premium Citrulline - 400 g (Cytrulina);Odżywki i suplementy,Odżywki Przedtreningowe,Cytrulina;34.99;KFD CITR400;Uwaga: jabłczan cytruliny wykazuje silne właściwości higroskopijne (zbryla się). Jest to naturalna cecha. Nie dodajemy sztucznych przeciwzbrylaczy czy substancji, które blokują ten proces. Zbrylanie się nie wpływa w żadnym sposób na produkt, nie dochodzi do reakcji chemicznych i jabłczan cytruliny  nadal jest tym samym jabłczanem cytruliny. Już sam surowiec jest dość mocno zbrylony, dlatego podczas produkcji używamy specjalnych młynków, aby doprowadzić go do sypkiej postaci oraz by proces konfekcjonowania mógł w ogóle się odbyć. Produkt ponownie zaczyna się zbrylać już po kilku godzinach od tego momentu. KFD Premium Citrulline to aż 400 g najwyższej jakości Jabłczanu L-Cytruliny z dodatkiem naszej autorskiej receptury smakowej. Produkt nie zawiera zbędnych wypełniaczy jak np. tańsze aminokwasy. Cytrulina według publikacji naukowych może się przyczynić do wzrostu wydolności treningowej 1 , podniesienia stężenia tlenku azotu we krwi oraz spotęgowania efektu tak zwanej pompy mięśniowej. KFD Premium Citrulline to: aż 80 porcji produktu w dobrej cenie wyjątkowa receptura smakowa, bardzo dobra rozpuszczalność Źródło: 1. http://bjsm.bmj.com/content/36/4/282.long;1 porcję - 5 g (1 miarka) należy wsypać do pojemnika z 150 -200 ml wody lub soku i wymieszać. Stosować bezpośrednio po przygotowaniu, nie częściej niż raz dziennie, np przed treningiem.;0.500000;KFD Nutrition;https://sklep.kfd.pl/9178-home_default/kfd-premium-citrulline-400-g-cytrulina.jpg,https://sklep.kfd.pl/9178-large_default/kfd-premium-citrulline-400-g-cytrulina.jpg;Sposób użycia:1 porcję - 5 g (1 miarka) należy wsypać do pojemnika z 150 -200 ml wody lub soku i wymieszać. Stosować bezpośrednio po przygotowaniu, nie częściej niż raz dziennie, np przed treningiem.:0:1
49;KFD Przecinarka / gilotyna do tabletek;Akcesoria i ubrania,Akcesoria treningowe,Pozostałe akcesoria;4.69;KFD PRZECINARKA;Koniec z szukaniem po całym pomieszczeniu połowy tabletki, odskakującej spod noża! Ten niewielki gadżet umożliwia przecięcie tabletki, podzielenie jej na dawki wg wskazań albo rekomendowanej przez producenta. Przecięte tabletki można przechowywać w wyznaczonej w przecinarce przegródce. Zamknięcie przecinarki uniemożliwia wypadnięcie tabletek.;;0.025000;KFD Nutrition;https://sklep.kfd.pl/8442-home_default/kfd-przecinarka-gilotyna-do-tabletek.jpg,https://sklep.kfd.pl/8442-large_default/kfd-przecinarka-gilotyna-do-tabletek.jpg;
50;KFD Pillows - cacao & nut - 180 g (płatki / poduszki śniadaniowe);Zdrowa Żywność,Słodycze i przekąski,Pozostałe słodycze i przekąski;8.99;KFD JASKI;KFD Pillows to przepyszne płatki zbożowe nadziewane kremem orzechowo-kakaowym i słodzone maltitolami. Produkt zawiera wyłącznie naturalnie występujące cukry. Lekkie i chrupiące poduszeczki, z kremem, który zawiera prawdziwe orzechy laskowe i kakao, mogą stanowić samodzielną przekąskę, jak i być składnikiem wielu dań na słodko. Świetnie nadają się do spożycia z mlekiem albo szejkiem białkowym. Można nimi posypać owsiankę, sałatkę owocową lub udekorować wypieki. Mimo że, kalorycznością nie odbiegają od klasycznych płatków śniadaniowych, mogą stanowić dobra alternatywę dla osób, które ograniczają udział cukru w diecie. Produkt wzbogacony o błonnik pochodzący z otrębów pszennych. KFD Pillows to: - pyszna i lekka przekąska, - zawiera wyłącznie naturalnie występujące cukry, - bez oleju palmowego, - nadzienie z prawdziwym kremem z orzechów laskowych, - świetne jako samodzielna przekąska oraz dodatek do deserów.;;0.250000;KFD Nutrition;https://sklep.kfd.pl/14682-home_default/kfd-pillows-cacao-nut-180-g-platki-sniadaniowe.jpg,https://sklep.kfd.pl/14682-large_default/kfd-pillows-cacao-nut-180-g-platki-sniadaniowe.jpg;
51;KFD Premium Beta-Alanine 300 g (Beta-Alanina);Odżywki i suplementy,Odżywki Przedtreningowe,Beta Alanina;37.99;KFD BETA-ALANI30;"KFD Premium Beta-Alanine to czysta beta-alanina, bez zbędnych dodatków technologicznych. Produkt dostępny jest także w wersjach smakowych, zawierających tylko niezbędne substancje aromatowe i smakowe. Beta-alanina to aminokwas, który jest naturalnie obecny w organizmie i należy do popularnych składników suplementów przeznaczanych dla osób, które sa aktywne fizycznie. Ma także zastosowanie jako uzupełnienie zróżnicowanej diety i aktywnego trybu życia. Uwaga: partie z oznaczeniem od: 1/12/2023 zawierają małą miarkę 1 ml, zamiast większej 10 ml. Do odmierzania nowych partii produktu zgodnie z instrukcją na opakowaniu, należy używać wyłącznie załączonej do produktu miarki. Literatura: [1] - U.S. National Library of Medicine/ National Center for Biotechnology Information PubChem CID: 439224 [2] - Wikipedia - Beta-Alanina Uwagi dotyczące produktu - Zalecana ilość wody użytej do przygotowania 1 porcji, jest nieco inna niż widoczna na opakowaniu. Szczegóły w zakładce ""Sposób użycia"". - Beta-Alanina wykazuje właściwości higroskopijne (jest podatna na wchłanianie wilgoci). Tworzenie się tzw. zbryleń, nie oznacza utraty właściwości produktu. Zalecamy jednak szczelne zamykanie opakowania po każdym użyciu aby ograniczyć dostawanie się wilgoci z otoczenia. UWAGA - Receptura smakowa została opracowana dla 100 ml wody lub soku. Informacja widoczna na opakowaniu (""150 - 200 ml"") uwzględniała sugestie producenta dotyczące ilości płynu jaki należy spożyć wraz z podaniem beta-alaniny.";Uwaga: partie z oznaczeniem od: 1/12/2023 zawierają małą miarkę 1 ml, zamiast większej 10 ml. Do odmierzania nowych partii produktu zgodnie z instrukcją na opakowaniu, należy używać wyłącznie załączonej do produktu miarki. 800 mg trzy razy dziennie. Jedną porcję - 800 mg (1 płaska miarka 1 ml) należy wsypać do naczynia z 50-100 ml wody lub soku i wymieszać. Stosować natychmiast po przygotowaniu, w zależności od indywidualnych potrzeb. Dla odmierzenia dokładnej porcji sugeruje się użycie wagi.;0.396000;KFD Nutrition;https://sklep.kfd.pl/13371-home_default/kfd-premium-beta-alanine-300-g-beta-alanina.jpg,https://sklep.kfd.pl/13371-large_default/kfd-premium-beta-alanine-300-g-beta-alanina.jpg;Sposób użycia:Uwaga: partie z oznaczeniem od: 1/12/2023 zawierają małą miarkę 1 ml, zamiast większej 10 ml. Do odmierzania nowych partii produktu zgodnie z instrukcją na opakowaniu, należy używać wyłącznie załączonej do produktu miarki. 800 mg trzy razy dziennie. Jedną porcję - 800 mg (1 płaska miarka 1 ml) należy wsypać do naczynia z 50-100 ml wody lub soku i wymieszać. Stosować natychmiast po przygotowaniu, w zależności od indywidualnych potrzeb. Dla odmierzenia dokładnej porcji sugeruje się użycie wagi.:0:1
52;KFD Przyprawa do sałatek 150 g;Zdrowa Żywność,Kuchnia i dieta,Przyprawy i aromaty;8.99;PRZYPRAWA DO SALATEK;KFD Przyprawa do sałatek 150 g to mieszanka ziół i suszonych warzyw przeznaczona do sałatek. Pasuje do wszelkiego rodzaju sałatek warzywnych i mięsnych ze względu na intensywny aromat ziół, przypraw i suszonych warzyw, które pozwalają delektować się smakiem naszych posiłków nawet na diecie. W skład kompozycji wchodzą tylko i wyłącznie naturalne składniki, takie jak przyprawy i zioła. Produkt nie zawiera w składzie wypełniaczy i konserwantów. Wyprodukowany został z najwyższej jakości półproduktów na terenie zielonych płuc Polski, niemal w całości własnoręcznie - bez wykorzystania maszyn, które mogłyby wpłynąć niepożądanie na jakość i walory smakowe produktu. Waga netto: 150 g;;0.192000;KFD Nutrition;https://sklep.kfd.pl/15166-large_default/kfd-przyprawa-do-salatek-150-g.jpg,https://sklep.kfd.pl/15166-home_default/kfd-przyprawa-do-salatek-150-g.jpg;
53;KFD Clear Whey 90 (hydrolizat WPI 90) 420 g - Izolat białka;Odżywki i suplementy,Białko,Izolat białka;69.99;CLEARWPI;"KFD Clear Whey 90 to produkt bazujący na znanym, renomowanym hydrolizacie białek serwatkowych wytworzonym z najwyższej jakości WPI 90 , w oryginalnych recepturach smakowych KFD . Zawiera aż ~ 90% (w suchej masie) poddanego procesowi hydrolizy białka. To doskonały wybór dla osób, które szukają zaawansowanej alternatywy dla tradycyjnego WPI 90 , bez intensywnego, mlecznego posmaku. Po rozpuszczeniu KFD Clear Whey 90 z wodą, otrzymasz klarowny napój w orzeźwiających owocowych smakach bez mocno wyczuwalnej nuty mlecznej. Wolisz białko z mlekiem? KFD Clear Whey 90 możesz przygotować również w ten sposób. Czym jest hydrolizowany izolat białka serwatkowego? Białko serwatkowe poddane procesowi hydrolizy zostaje częściowo ""rozbite"" na wolne aminokwasy. Każde źródło protein może zostać poddane hydrolizie. Jeżeli hydrolizujemy zwykły koncentrat białka serwatkowego, to nadal otrzymujemy surowiec o zawartości 70-80% białka, tylko częściowo ""pocięty"" na aminokwasy. KFD Clear Whey 90 powstał z wysokiej klasy izolatu białek serwatkowych, stąd jego wysoka zawartość protein oraz minimalny udział tłuszczów i cukrów. Unikalna technologia pozwoliła uzyskać efekt klarowności po wymieszaniu białka z wodą. KFD Clear Whey 90 to: - klarowny, orzeźwiający napój proteinowy do przygotowania z wodą, - oryginalna alternatywa dla klasycznych szejków, - bogate źródło lekkostrawnego białka, - blisko 90 g białka w 100 g produktu, - wysokiej klasy surowiec z oryginalnymi recepturami smakowymi KFD. Uwaga: Aby otrzymać klarowny napój, rozpuść zalecaną porcję produktu w 200 ml wody lub soku i bardzo energicznie wymieszaj. Odstaw produkt na kilka minut, aż opadnie piana . Z względu na niskie pH surowca, występowanie piany jest naturalne. Mimo najszczerszych starań KFD Clear Whey 90 to nadal produkt białkowy bez dodatku cukru i nie będzie smakował tak jak popularne, słodzone napoje. Mimo to uważamy, że i tak znajdzie swoich fanów. Badania na zawartość cukrów z dn. 24.01.2023";1 porcje 30 g (około 1 i 1/3 miarki) wsypać do shakera z 200 ml wody, energicznie wymieszać i odstawić aż opadnie piana. Ze względu na niskie PH surowca, występowanie piany jest naturalne.;0.520000;KFD Nutrition;https://sklep.kfd.pl/13969-large_default/kfd-clear-whey-90-whey-protein-isolate-420-g-hydrolizowany-izolat-bialka-serwatkowego.jpg,https://sklep.kfd.pl/13969-home_default/kfd-clear-whey-90-whey-protein-isolate-420-g-hydrolizowany-izolat-bialka-serwatkowego.jpg;Sposób użycia:1 porcje 30 g (około 1 i 1/3 miarki) wsypać do shakera z 200 ml wody, energicznie wymieszać i odstawić aż opadnie piana. Ze względu na niskie PH surowca, występowanie piany jest naturalne.:0:1
54;KFD - SHAKER Zakręcany BEZBARWNY 700ml (szejker) - widoczna miarka;Akcesoria i ubrania,Akcesoria treningowe,Shakery i kanistry;11.99;KFD SHAKER MAS;Profesjonalny, zakręcany shaker znanej niemieckiej firmy o pojemności 700 ml z sitkiem i miarką z boku. Oferowane shakery posiadają logo KFD. Pojemnik na płyn jest BEZBARWNY , dzięki czemu dokładnie widać ilość płynu. Idealny do przygotowywania szejków białkowych, gainerów oraz pozostałych preparatów wymagających wymieszania z płynem. UWAGA - Przed pierwszym użyciem umyj shaker. Oddziel wszystkie części przed czyszczeniem. Myj ręcznie w ciepłej wodzie z płynem do mycia naczyń i dokładnie opłucz. Jeśli pojawia się nieszczelność, wynika to po prostu ze złego dokręcenia (wystarczy różnica 0,5 mm na gwincie).;;0.900000;KFD Nutrition;https://sklep.kfd.pl/6456-home_default/kfd-shaker-zakrecany-bezbarwny-700-ml.jpg,https://sklep.kfd.pl/6456-large_default/kfd-shaker-zakrecany-bezbarwny-700-ml.jpg;
55;Pill box /Pillbox zamykany na tabletki - KFD - (pudełko na tabletki);Akcesoria i ubrania,Akcesoria treningowe,Pozostałe akcesoria;3.99;KFD PILLBOX;Profesjonalne, zamykane pudełko na tabletki/ kapsułki znanej niemieckiej firmy Buchsteiner (najlepsze shakery i pillboxy na świecie). Stylowy i trwały nadruk KFD w trzech kolorach do wyboru. Idealny do przechowywania tabletek i kapsułek przeznaczonych do zażywania o różnych porach.;;0.050000;KFD Nutrition;https://sklep.kfd.pl/5267-large_default/pill-box-pillbox-zamykany-na-tabletki-kfd-pudelko-na-tabletki.jpg,https://sklep.kfd.pl/5267-home_default/pill-box-pillbox-zamykany-na-tabletki-kfd-pudelko-na-tabletki.jpg;
56;KFD Vitamin D3+K2 (MK7) - 200 kapsułek;Zdrowie i kondycja,Witaminy i minerały,Witaminy;21.99;KFD D+K NEW;UWAGA - ze względu na zaostrzenie przepisów, maksymalna dawka witaminy D3 na 1 porcję to 2000 jednostek. Aby klienci nie odczuli zmiany, produkt obecnie zawiera przepisową dawkę witaminy D3 i K2, ale zawiera aż 2 x więcej kapsułek i jest w identycznej cenie :-) KFD Witamina D+K to suplement diety dostarczający aż 2000 j.m. (50 mcg) witaminy D3 oraz 50 mcg witaminy K2 (menachinon 7) w 1 kapsułce. Witamina D: - pomaga w prawidłowym wchłanianiu/wykorzystywaniu wapnia i fosforu - pomaga w utrzymaniu prawidłowego poziomu wapnia we krwi - pomaga w utrzymaniu zdrowych kości - pomaga w prawidłowym funkcjonowaniu mięśni - pomaga w utrzymaniu zdrowych zębów - pomaga w prawidłowym funkcjonowaniu układu odpornościowego Witamina K: - przyczynia się do prawidłowego krzepnięcia krwi - pomaga w utrzymaniu zdrowych kości Witamina D należy do grupy witamin rozpuszczalnych w tłuszczach, aby jej wchłanialność w organizmie była prawidłowa, produkt należy spożywać wraz z posiłkiem bogatym w tłuszcz. Źródła: - witamina K https://pmc.ncbi.nlm.nih.gov/articles/PMC7399911/ - witamina D https://pmc.ncbi.nlm.nih.gov/articles/PMC10623655/;1 kapsułkę spożyć w całości po lub w trakcie posiłku zawierającego tłuszcz i popić wodą lub innym napojem.;0.100000;KFD Nutrition;https://sklep.kfd.pl/9132-large_default/kfd-vitamin-d3k2-mk7-200-kapsulek.jpg,https://sklep.kfd.pl/9132-home_default/kfd-vitamin-d3k2-mk7-200-kapsulek.jpg;Sposób użycia:1 kapsułkę spożyć w całości po lub w trakcie posiłku zawierającego tłuszcz i popić wodą lub innym napojem.:0:1
